{
  "$schema": "https://json-schema.org/draft/2020-12/schema",
  "type": "object",
  "properties": {
    "schemaVersion": {
      "type": "integer"
    },
    "eventId": {
      "type": [
        "integer",
        "null"
      ]
    },
    "eventStatusId": {
      "type": [
        "integer",
        "null"
      ]
    },
    "pollIntervalMs": {
      "type": "integer"
    },
    "hubEnabled": {
      "type": "boolean"
    },
    "snapshotUrl": {
      "type": "string"
    },
    "cookieTally": {
      "type": "object",
      "additionalProperties": {
        "type": "integer"
      }
    },
    "seq": {
      "type": [
        "integer",
        "null"
      ]
    },
    "lat": {
      "type": [
        "number",
        "null"
      ]
    },
    "lng": {
      "type": [
        "number",
        "null"
      ]
    },
    "speedMps": {
      "type": [
        "number",
        "null"
      ]
    },
    "altitudeM": {
      "type": [
        "number",
        "null"
      ]
    },
    "headingDeg": {
      "type": [
        "number",
        "null"
      ]
    },
    "accuracyM": {
      "type": [
        "number",
        "null"
      ]
    },
    "recordedAt": {
      "type": [
        "string",
        "null"
      ],
      "format": "date-time"
    },
    "receivedAt": {
      "type": [
        "string",
        "null"
      ],
      "format": "date-time"
    },
    "publishedAt": {
      "type": "string",
      "format": "date-time"
    },
    "onlineCount": {
      "type": [
        "integer",
        "null"
      ]
    }
  },
  "additionalProperties": false
}