{"schemaVersion":1,"eventId":7,"eventStatusId":3,"pollIntervalMs":5000,"hubEnabled":true,"snapshotUrl":"https://cdn.example/snapshots/3f9a1c8c1d5e2a7b3f4c9e9a1d2f6e8b4c0a113b7e9c102d4f4a8bb6c19e0b2e1.json","cookieTally":{"1":412,"3":90},"seq":1832,"lat":46.87,"lng":-114,"speedMps":31.2,"altitudeM":1210,"headingDeg":84,"accuracyM":6,"recordedAt":"2026-12-22T01:31:07.000Z","receivedAt":"2026-12-22T01:31:07.412Z","publishedAt":"2026-12-22T01:31:07.430Z","onlineCount":214}